{
  "_meta": {
    "generated_by": "ads-signal.mjs",
    "version": "0.1.0",
    "computed_at": "2026-06-08T00:29:19.484Z",
    "input_file": ".prepkit/scripts/fixtures/meta-ads-export.sample.json",
    "input_synthetic": true,
    "account": {
      "id": "SYN-TEST-0001",
      "name": "Synthetic Test Account",
      "currency": "USD",
      "objective": "OUTCOME_ENGAGEMENT"
    },
    "date_range": {
      "start": "2026-03-07",
      "end": "2026-06-04",
      "days": 90
    },
    "methodology": {
      "synthesized": true,
      "note": "No canonical public fatigue formula exists (design §5.3). These weights/thresholds are synthesized defaults surfaced for human override at the design-lock checkpoint (Open Q#4). ctr_decline_wow is UNAVAILABLE on a 90d aggregate (no weekly series) and its weight is redistributed onto the available signals — no decline is fabricated. scale_room is a frequency-headroom heuristic (unweighted row averages; CTR-vs-account and impression-weighting not yet folded in) — also a Q#4 refinement.",
      "fatigue_weights": {
        "frequency_vs_threshold": 0.55,
        "ctr_vs_median": 0.3,
        "ctr_decline_wow": 0.15,
        "weekly_series_available": false,
        "effective_after_redistribution": {
          "frequency_vs_threshold": 0.6471,
          "ctr_vs_median": 0.3529,
          "ctr_decline_wow": "UNAVAILABLE"
        }
      },
      "fatigue_bands": {
        "HEALTHY": "0-39",
        "WATCH": "40-59",
        "ROTATE": "60-79",
        "PAUSE": "80-100"
      },
      "significance_thresholds": {
        "runtime_floor_days": 7,
        "impression_floor": 50000,
        "spend_floor": 1000,
        "spend_floor_currency": "USD",
        "spend_floor_applied": true,
        "noise_delta": 0.1,
        "signal_delta": 0.3
      },
      "audience_classes": {
        "source": "per-row `audience_type` (cold|retarget); else an RT/REMARKETING/RETARGET tag marker; else default cold-prospecting",
        "cold_prospecting": {
          "freq_threshold_low": 2.5,
          "freq_threshold_high": 3
        },
        "retargeting": {
          "match": "(?<![a-z0-9])(RT|REMARKETING|RETARGET)(?![a-z0-9])",
          "freq_threshold_low": 4,
          "freq_threshold_high": 6
        }
      }
    }
  },
  "account_summary": {
    "objective": "OUTCOME_ENGAGEMENT",
    "outcome_metrics_available": false,
    "median_ctr": 0.0125,
    "total_spend": 148350,
    "row_count": 12,
    "tier_b_note": "Objective is engagement — Tier-B outcome metrics (ROAS/CPA) are UNAVAILABLE and are never inferred. All ranked signals are ATTENTION proxies, not conversion-validated."
  },
  "rows": [
    {
      "campaign": "C01 — broad reach saturation",
      "ad": "broad-A",
      "status": "ACTIVE",
      "audience_tag": "lookalike-broad",
      "audience_class": "cold-prospecting",
      "spend": 60000,
      "impressions": 12000000,
      "reach": 1600000,
      "clicks": 72000,
      "purchases": 180,
      "runtime_days": 84,
      "ctr": 0.006,
      "cpc": 1,
      "cpm": 5,
      "frequency": 7.5,
      "hook_rate": "UNAVAILABLE",
      "hold_rate": "UNAVAILABLE",
      "ctr_delta_vs_median": -0.52,
      "ctr_delta_label": "signal",
      "fatigue_score": 100,
      "fatigue_band": "PAUSE",
      "fatigue_action": "PAUSE",
      "confidence_tier": "HIGH",
      "sample_flag": "OK",
      "signal_class": {
        "tier": "PROXY_ATTENTION",
        "outcome_validated": false,
        "tier_b": {
          "roas": "UNAVAILABLE",
          "cpa": "UNAVAILABLE"
        }
      }
    },
    {
      "campaign": "C02 — high-intent winner (short runtime)",
      "ad": "winner-A",
      "status": "PAUSED",
      "audience_tag": "career-switchers",
      "audience_class": "cold-prospecting",
      "spend": 600,
      "impressions": 40000,
      "reach": 33000,
      "clicks": 1000,
      "purchases": 0,
      "runtime_days": 6,
      "ctr": 0.025,
      "cpc": 1,
      "cpm": 15,
      "frequency": 1.21,
      "hook_rate": "UNAVAILABLE",
      "hold_rate": "UNAVAILABLE",
      "ctr_delta_vs_median": 1,
      "ctr_delta_label": "signal",
      "fatigue_score": 0,
      "fatigue_band": "HEALTHY",
      "fatigue_action": "NONE",
      "confidence_tier": "LOW",
      "sample_flag": "LOW_CONFIDENCE",
      "signal_class": {
        "tier": "PROXY_ATTENTION",
        "outcome_validated": false,
        "tier_b": {
          "roas": "UNAVAILABLE",
          "cpa": "UNAVAILABLE"
        }
      }
    },
    {
      "campaign": "C03 — high-intent winner (low spend)",
      "ad": "winner-B",
      "status": "PAUSED",
      "audience_tag": "career-switchers",
      "audience_class": "cold-prospecting",
      "spend": 550,
      "impressions": 38000,
      "reach": 32000,
      "clicks": 836,
      "purchases": 0,
      "runtime_days": 30,
      "ctr": 0.022,
      "cpc": 1,
      "cpm": 14,
      "frequency": 1.19,
      "hook_rate": "UNAVAILABLE",
      "hold_rate": "UNAVAILABLE",
      "ctr_delta_vs_median": 0.76,
      "ctr_delta_label": "signal",
      "fatigue_score": 0,
      "fatigue_band": "HEALTHY",
      "fatigue_action": "NONE",
      "confidence_tier": "LOW",
      "sample_flag": "LOW_CONFIDENCE",
      "signal_class": {
        "tier": "PROXY_ATTENTION",
        "outcome_validated": false,
        "tier_b": {
          "roas": "UNAVAILABLE",
          "cpa": "UNAVAILABLE"
        }
      }
    },
    {
      "campaign": "C04 — core pain hook 1",
      "ad": "core-A",
      "status": "ACTIVE",
      "audience_tag": "prospecting-core",
      "audience_class": "cold-prospecting",
      "spend": 18000,
      "impressions": 1200000,
      "reach": 750000,
      "clicks": 16800,
      "purchases": 40,
      "runtime_days": 70,
      "ctr": 0.014,
      "cpc": 1,
      "cpm": 15,
      "frequency": 1.6,
      "hook_rate": "UNAVAILABLE",
      "hold_rate": "UNAVAILABLE",
      "ctr_delta_vs_median": 0.12,
      "ctr_delta_label": "neutral",
      "fatigue_score": 0,
      "fatigue_band": "HEALTHY",
      "fatigue_action": "NONE",
      "confidence_tier": "HIGH",
      "sample_flag": "OK",
      "signal_class": {
        "tier": "PROXY_ATTENTION",
        "outcome_validated": false,
        "tier_b": {
          "roas": "UNAVAILABLE",
          "cpa": "UNAVAILABLE"
        }
      }
    },
    {
      "campaign": "C05 — core pain hook 2",
      "ad": "core-B",
      "status": "ACTIVE",
      "audience_tag": "prospecting-core",
      "audience_class": "cold-prospecting",
      "spend": 16000,
      "impressions": 1100000,
      "reach": 611000,
      "clicks": 13200,
      "purchases": 28,
      "runtime_days": 65,
      "ctr": 0.012,
      "cpc": 1,
      "cpm": 15,
      "frequency": 1.8,
      "hook_rate": "UNAVAILABLE",
      "hold_rate": "UNAVAILABLE",
      "ctr_delta_vs_median": -0.04,
      "ctr_delta_label": "noise",
      "fatigue_score": 2.8,
      "fatigue_band": "HEALTHY",
      "fatigue_action": "NONE",
      "confidence_tier": "HIGH",
      "sample_flag": "OK",
      "signal_class": {
        "tier": "PROXY_ATTENTION",
        "outcome_validated": false,
        "tier_b": {
          "roas": "UNAVAILABLE",
          "cpa": "UNAVAILABLE"
        }
      }
    },
    {
      "campaign": "C06 — core fresh video",
      "ad": "core-video",
      "status": "ACTIVE",
      "audience_tag": "prospecting-fresh",
      "audience_class": "cold-prospecting",
      "spend": 14000,
      "impressions": 1000000,
      "reach": 526000,
      "clicks": 13000,
      "purchases": 22,
      "runtime_days": 60,
      "ctr": 0.013,
      "cpc": 1,
      "cpm": 14,
      "frequency": 1.9,
      "hook_rate": 0.35,
      "hold_rate": 0.35,
      "ctr_delta_vs_median": 0.04,
      "ctr_delta_label": "noise",
      "fatigue_score": 0,
      "fatigue_band": "HEALTHY",
      "fatigue_action": "NONE",
      "confidence_tier": "HIGH",
      "sample_flag": "OK",
      "signal_class": {
        "tier": "PROXY_ATTENTION",
        "outcome_validated": false,
        "tier_b": {
          "roas": "UNAVAILABLE",
          "cpa": "UNAVAILABLE"
        }
      }
    },
    {
      "campaign": "C07 — value-seekers video",
      "ad": "value-video",
      "status": "ACTIVE",
      "audience_tag": "value-seekers",
      "audience_class": "cold-prospecting",
      "spend": 9700,
      "impressions": 700000,
      "reach": 460000,
      "clicks": 9800,
      "purchases": 18,
      "runtime_days": 50,
      "ctr": 0.014,
      "cpc": 1,
      "cpm": 14,
      "frequency": 1.52,
      "hook_rate": 0.3,
      "hold_rate": 0.3,
      "ctr_delta_vs_median": 0.12,
      "ctr_delta_label": "neutral",
      "fatigue_score": 0,
      "fatigue_band": "HEALTHY",
      "fatigue_action": "NONE",
      "confidence_tier": "HIGH",
      "sample_flag": "OK",
      "signal_class": {
        "tier": "PROXY_ATTENTION",
        "outcome_validated": false,
        "tier_b": {
          "roas": "UNAVAILABLE",
          "cpa": "UNAVAILABLE"
        }
      }
    },
    {
      "campaign": "C08 — career mid (no video)",
      "ad": "career-mid",
      "status": "ACTIVE",
      "audience_tag": "career-switchers",
      "audience_class": "cold-prospecting",
      "spend": 3300,
      "impressions": 320000,
      "reach": 168000,
      "clicks": 3520,
      "purchases": 6,
      "runtime_days": 40,
      "ctr": 0.011,
      "cpc": 1,
      "cpm": 10,
      "frequency": 1.9,
      "hook_rate": "UNAVAILABLE",
      "hold_rate": "UNAVAILABLE",
      "ctr_delta_vs_median": -0.12,
      "ctr_delta_label": "neutral",
      "fatigue_score": 8.5,
      "fatigue_band": "HEALTHY",
      "fatigue_action": "NONE",
      "confidence_tier": "HIGH",
      "sample_flag": "OK",
      "signal_class": {
        "tier": "PROXY_ATTENTION",
        "outcome_validated": false,
        "tier_b": {
          "roas": "UNAVAILABLE",
          "cpa": "UNAVAILABLE"
        }
      }
    },
    {
      "campaign": "C09 — scarcity overexposed",
      "ad": "scarcity-A",